{
  "definitions": {},
  "$schema": "http://json-schema.org/draft-07/schema#",
  "$id": "subject-patch",
  "title": "Data Item",
  "type": "object",
  "properties": {
    "question": {
      "$id": "#root/question",
      "title": "Question",
      "type": "string",
      "default": ""
    },
    "id": {
      "$id": "#root/id",
      "title": "Id",
      "type": "string",
      "default": 0
    },
    "numberOfComments": {
      "$id": "#root/numberOfComments",
      "title": "Number of Comments",
      "type": "integer",
      "default": 0
    },
    "answers": {
      "$id": "#root/answers",
      "title": "Answers",
      "type": "array",
      "default": [],
      "items": {
        "$id": "#root/answers/items",
        "title": "Items",
        "type": "object",
        "required": ["answer", "correct"],
        "properties": {
          "answer": {
            "$id": "#root/answers/items/answer",
            "title": "Answer",
            "type": "string",
            "default": ""
          },
          "correct": {
            "$id": "#root/answers/items/correct",
            "title": "Correct",
            "type": "boolean",
            "default": true
          },
          "isMarkdown": {
            "$id": "#root/answers/items/isMarkdown",
            "title": "Is Markdown",
            "type": "boolean",
            "default": false
          }
        }
      }
    },
    "comments": {
      "type": "array",
      "items": {
        "type": "object",
        "properties": {
          "author": {
            "type": "string"
          },
          "comment": {
            "type": "string"
          },
          "date": {
            "type": "string",
            "pattern": "^[0-9]{2}-[0-9]{2}-[0-9]{4} [0-9]{2}:[0-9]{2}:[0-9]{2}$"
          }
        },
        "required": ["author", "comment", "date"]
      }
    },
    "contributors": {
      "$id": "#root/contributors",
      "title": "Contributors",
      "type": "array",
      "items": {
        "type": "string"
      }
    },
    "createdAt": {
      "$id": "#root/createdAt",
      "title": "Created At",
      "type": "integer",
      "default": 0
    },
    "isMarkdown": {
      "$id": "#root/isMarkdown",
      "title": "Is Markdown",
      "type": "boolean",
      "default": false
    }
  },
  "required": ["question", "id", "createdAt"]
}
