{
  "question": "Class extent and object mean the same thing.",
  "numberOfComments": 1,
  "answers": [
    {
      "answer": "Yes",
      "correct": false
    },
    {
      "answer": "No",
      "correct": true
    }
  ],
  "comments": [
    {
      "author": "Samuele Milan",
      "comment": "Class extent is a collection of all objects.",
      "date": "02-09-2023 00:00:00"
    }
  ],
  "contributors": [
    "Samuele Milan"
  ],
  "id": "z-03-3e07c723-7034-40e5-b9b6-9a1551687be0",
  "createdAt": 1691363367006,
  "$schema": "../../../schemas/subject-patch.json"
}
