{
  "question": "W MS SQL Server wykonywana była pełna kopia zapasowa nocy z soboty na niedzielę. Następnie co godzinę każdego dnia w godz. 8-16 wykonywana była kopia dziennika transakcji. Awaria nastąpiła w środę o 12:01. Których kopii zapasowych i w jakiej kolejności użyjesz, aby odtworzyć tą bazę danych?",
  "isMarkdown": true,
  "comments": [],
  "answers": [
    {
      "answer": "Najpierw pełny z weekendu, następnie wszystkie po kolei kopie dziennika transakcji wykonane po pełnym.",
      "correct": false
    },
    {
      "answer": "Najpierw pełny z weekendu, a następnie log ze środy z godz. 12:00.",
      "correct": false
    },
    {
      "answer": "Nie da się odtworzyć tej bazy, gdyż brakuje kopii różnicowej.",
      "correct": false
    },
    {
      "answer": "Najpierw pełny, a następnie wszystkie logi wykonane od ostatniego restartu serwera.",
      "correct": false
    }
  ],
  "id": "z-13-316a3e87-45b8-4a87-be3d-9b9f83cb63ce",
  "createdAt": 1657199812909,
  "$schema": "../../../schemas/subject-patch.json"
}
