{
  "question": "To create a class method in Java, use the class keyword.",
  "numberOfComments": 1,
  "answers": [
    {
      "answer": "Yes",
      "correct": false
    },
    {
      "answer": "No",
      "correct": true
    }
  ],
  "comments": [
    {
      "author": "Samuele Milan",
      "comment": "In Java, class methods are created using the static keyword.",
      "date": "02-09-2023 00:00:00"
    }
  ],
  "contributors": [
    "Samuele Milan"
  ],
  "id": "z-21-8b4e8809-611b-43b0-85b4-62fac5def066",
  "createdAt": 1691363367006,
  "$schema": "../../../schemas/subject-patch.json"
}
