{
  "question": "The workload needed to create your own GUI library is comparable to that required for existing modification.",
  "numberOfComments": 1,
  "answers": [
    {
      "answer": "Yes",
      "correct": false
    },
    {
      "answer": "No",
      "correct": true
    }
  ],
  "comments": [
    {
      "author": "Samuele Milan",
      "comment": "Modifying an existing library is a lot simpler than creating your own from scratch.",
      "date": "02-09-2023 00:00:00"
    }
  ],
  "contributors": [
    "Samuele Milan"
  ],
  "id": "z-148-9054998a-392a-4b66-a3fe-a2f8ea0afa8f",
  "createdAt": 1691363367006,
  "$schema": "../../../schemas/subject-patch.json"
}
