{
  "question": "The most precise way to write constraints is the natural language.",
  "numberOfComments": 1,
  "answers": [
    {
      "answer": "Yes",
      "correct": false
    },
    {
      "answer": "No",
      "correct": true
    }
  ],
  "comments": [
    {
      "author": "Samuele Milan",
      "comment": "Unfortunately, natural language is one of the least restrictive ways of defining constraints",
      "date": "02-09-2023 00:00:00"
    }
  ],
  "contributors": [
    "Samuele Milan"
  ],
  "id": "z-64-51415045-3531-4784-82c7-aa213d107467",
  "createdAt": 1691363367006,
  "$schema": "../../../schemas/subject-patch.json"
}
