{
  "question": "The ProgressWorker class displays the progress bar.",
  "numberOfComments": 1,
  "answers": [
    {
      "answer": "Yes",
      "correct": true
    },
    {
      "answer": "No",
      "correct": false
    }
  ],
  "comments": [
    {
      "author": "Samuele Milan",
      "comment": "One of the improvements to the ProgressWorker is to add a progress bar.",
      "date": "02-09-2023 00:00:00"
    }
  ],
  "contributors": [
    "Samuele Milan"
  ],
  "id": "z-157-38568726-3622-4f4a-aed9-ae495ecf7cd9",
  "createdAt": 1691363367006,
  "$schema": "../../../schemas/subject-patch.json"
}
