{
  "question": "Classes are mapped to relational tables.",
  "numberOfComments": 1,
  "answers": [
    {
      "answer": "Yes",
      "correct": true
    },
    {
      "answer": "No",
      "correct": false
    }
  ],
  "comments": [
    {
      "author": "Samuele Milan",
      "comment": "In fact, classes are mapped to relational tebels.",
      "date": "02-09-2023 00:00:00"
    }
  ],
  "contributors": [
    "Samuele Milan"
  ],
  "id": "z-87-2c906331-fbbc-49df-ac02-ad3b0807a810",
  "createdAt": 1691363367006,
  "$schema": "../../../schemas/subject-patch.json"
}
