{
  "question": "The simplest way to implement multi-aspect inheritance is to flatten the hierarchy.",
  "numberOfComments": 1,
  "answers": [
    {
      "answer": "Yes",
      "correct": true
    },
    {
      "answer": "No",
      "correct": false
    }
  ],
  "comments": [
    {
      "author": "Samuele Milan",
      "comment": "Flattening of the hierarchy is the easiest way to implement any kind of inheritance (including multi-aspect).",
      "date": "02-09-2023 00:00:00"
    }
  ],
  "contributors": [
    "Samuele Milan"
  ],
  "id": "z-59-19c0f53f-34d1-4656-b029-cefde57dca2f",
  "createdAt": 1691363367006,
  "$schema": "../../../schemas/subject-patch.json"
}
