{
  "question": "Multi-aspect inheritance is the same as multi-inheritance.",
  "numberOfComments": 1,
  "answers": [
    {
      "answer": "Yes",
      "correct": false
    },
    {
      "answer": "No",
      "correct": true
    }
  ],
  "comments": [
    {
      "author": "Samuele Milan",
      "comment": "Multi-aspect inheritance is different from multi-inheritance.",
      "date": "02-09-2023 00:00:00"
    }
  ],
  "contributors": [
    "Samuele Milan"
  ],
  "id": "z-57-1cfe2bde-b5b0-4098-a482-c6c71d684db8",
  "createdAt": 1691363367006,
  "$schema": "../../../schemas/subject-patch.json"
}
