{
  "question": "You do not have to watch your users during the usability tests - just listen to their comments.",
  "numberOfComments": 1,
  "answers": [
    {
      "answer": "Yes",
      "correct": false
    },
    {
      "answer": "No",
      "correct": true
    }
  ],
  "comments": [
    {
      "author": "Samuele Milan",
      "comment": "User comments may be misleading. Therefore, it is important to observe their behavior.",
      "date": "02-09-2023 00:00:00"
    }
  ],
  "contributors": [
    "Samuele Milan"
  ],
  "id": "z-132-aed05aba-bd52-4855-ae2b-bd72299e4245",
  "createdAt": 1691363367006,
  "$schema": "../../../schemas/subject-patch.json"
}
