{
  "question": "The basic principle used to implement constraints is to create public attributes and private methods.",
  "numberOfComments": 1,
  "answers": [
    {
      "answer": "Yes",
      "correct": false
    },
    {
      "answer": "No",
      "correct": true
    }
  ],
  "comments": [
    {
      "author": "Samuele Milan",
      "comment": "The basic principle used to implement constraints is to create private attributes and public methods (not vice versa)",
      "date": "02-09-2023 00:00:00"
    }
  ],
  "contributors": [
    "Samuele Milan"
  ],
  "id": "z-67-0f4e9c5f-b81b-4c73-91af-b5cb6cc15fac",
  "createdAt": 1691363367006,
  "$schema": "../../../schemas/subject-patch.json"
}
